<?xml version="1.0" encoding="UTF-8"?>
<culture xmlns:xsi="http://www.w3.org/2001/XMLSchema-instance"
	xsi:noNamespaceSchemaLocation="..\..\validation\culture.xsd">
	<name>culture_1</name>
	<family_characteristic>
		<female>char_female</female>
		<male>char_male</male>
	</family_characteristic>
	<initial_luck>
		<female>luck_female</female>
		<male>luck_male</male>
	</initial_luck>
	<template>
		<male>
			<attributes_bonus>
				<attribute>
					<name>attribute_1</name>
					<value>1</value>
				</attribute>
				<attribute>
					<name>attribute_2</name>
					<value>2</value>
				</attribute>
			</attributes_bonus>
			<attributes_random>
				<attribute>
					<name>attribute_1</name>
					<value>1d6</value>
				</attribute>
				<attribute>
					<name>attribute_2</name>
					<value>2d6</value>
				</attribute>
			</attributes_random>
			<traits_bonus>
				<trait>
					<name>trait_1</name>
					<value>6</value>
				</trait>
				<trait>
					<name>trait_2</name>
					<value>12</value>
				</trait>
			</traits_bonus>
			<skills_bonus>
				<skill>
					<name>skill_1</name>
					<value>10</value>
				</skill>
				<skill>
					<name>skill_2</name>
					<descriptor>descriptor_2</descriptor>
					<value>11</value>
				</skill>
			</skills_bonus>
			<specialty_skills>
				<specialty_skill>
					<name>specialty_1</name>
					<value>15</value>
				</specialty_skill>
				<specialty_skill>
					<name>specialty_2</name>
					<value>16</value>
				</specialty_skill>
			</specialty_skills>
			<passions_bonus>
				<passion>
					<name>passion_1</name>
					<value>17</value>
				</passion>
				<passion>
					<name>passion_2</name>
					<descriptor>descriptor_2</descriptor>
					<value>24</value>
				</passion>
			</passions_bonus>
			<passions_random>
				<passion>
					<name>passion_1</name>
					<value>3d6</value>
				</passion>
				<passion>
					<name>passion_2</name>
					<descriptor>descriptor_2</descriptor>
					<value>0</value>
				</passion>
				<passion>
					<name>passion_4</name>
					<value>5</value>
				</passion>
			</passions_random>
			<directed_traits_bonus>
				<directed_trait>
					<name>directed_1</name>
					<value>30</value>
				</directed_trait>
				<directed_trait>
					<name>directed_2</name>
					<descriptor>descriptor_2</descriptor>
					<value>1</value>
				</directed_trait>
			</directed_traits_bonus>
		</male>
		<female>
			<attributes_bonus>
				<attribute>
					<name>attribute_3</name>
					<value>3</value>
				</attribute>
			</attributes_bonus>
			<attributes_random>
				<attribute>
					<name>attribute_3</name>
					<value>10d2</value>
				</attribute>
			</attributes_random>
			<traits_bonus>
				<trait>
					<name>trait_3</name>
					<value>22</value>
				</trait>
			</traits_bonus>
			<skills_bonus>
				<skill>
					<name>skill_3</name>
					<value>12</value>
				</skill>
			</skills_bonus>
			<specialty_skills>
				<specialty_skill>
					<name>specialty_3</name>
					<value>17</value>
				</specialty_skill>
			</specialty_skills>
			<passions_bonus>
				<passion>
					<name>passion_3</name>
					<value>18</value>
				</passion>
			</passions_bonus>
			<passions_random>
				<passion>
					<name>passion_3</name>
					<value>6d6</value>
				</passion>
			</passions_random>
			<directed_traits_bonus>
				<directed_trait>
					<name>directed_3</name>
					<value>31</value>
				</directed_trait>
			</directed_traits_bonus>
		</female>
	</template>
</culture>
